{
  "target": "trial_to_target",
  "source_design": "randomized_trial",
  "source_validity_status": "plausible",
  "target_data": "individual_covariates",
  "effect_modifier_status": "partially_observed",
  "overlap_status": "limited",
  "treatment_version_match": "same",
  "outcome_version_match": "same",
  "site_context_difference": "moderate",
  "n_source": 800,
  "n_target": 5000,
  "language": "r",
  "has_multiple_sites": false
}
